{
  "$schema": "open-symbolic-rules/v0.1/inference",
  "section": "1.1",
  "title": "Binary Propositional Resolution",
  "system": "propositional-resolution",
  "semantics": {
    "Or": "openmath:logic1#or",
    "Not": "openmath:logic1#not"
  },
  "inferences": [
    {
      "id": 1,
      "premises": [
        [
          "Or",
          "p_",
          "q_"
        ],
        [
          "Or",
          [
            "Not",
            "p_"
          ],
          "r_"
        ]
      ],
      "constraints": [],
      "conclusion": [
        "Or",
        "q_",
        "r_"
      ],
      "description": "Resolve complementary literals in two clauses.",
      "provenance": {
        "method": "authored",
        "sources": [
          {
            "name": "OpenSymbolicRules Specification",
            "locator": "examples/propositional-resolution.inference.json:1"
          }
        ]
      }
    }
  ]
}
